{
  "$schema": "https://json-schema.org/draft/2020-12/schema",
  "$id": "https://github.com/paoloo/satsec-decomposition/blob/main/artifacts/transfer_diagnostic/cve-2025-32433/differential-lab-validation.schema.json",
  "title": "CVE-2025-32433 Differential Lab Validation",
  "type": "object",
  "additionalProperties": false,
  "required": [
    "schema_version",
    "cve_id",
    "network_isolation",
    "probe",
    "server_source_sha256",
    "reproducibility",
    "vulnerable",
    "patched"
  ],
  "properties": {
    "schema_version": { "const": "1.0.0" },
    "cve_id": { "const": "CVE-2025-32433" },
    "network_isolation": { "const": "compose-internal-only" },
    "probe": {
      "type": "object",
      "additionalProperties": false,
      "required": ["kind", "sha256", "marker_path", "marker_value"],
      "properties": {
        "kind": { "const": "fixed-marker-only" },
        "sha256": { "type": "string", "pattern": "^[a-f0-9]{64}$" },
        "marker_path": { "const": "/tmp/cve-2025-32433-proof" },
        "marker_value": { "const": "RH-LAB-PREAUTH-EXEC" }
      }
    },
    "server_source_sha256": { "type": "string", "pattern": "^[a-f0-9]{64}$" },
    "reproducibility": {
      "type": "object",
      "additionalProperties": false,
      "required": ["uncached_builds", "image_ids_equal"],
      "properties": {
        "uncached_builds": { "const": 2 },
        "image_ids_equal": { "const": true }
      }
    },
    "vulnerable": {
      "type": "object",
      "additionalProperties": false,
      "required": ["otp_version", "image_id", "marker_observed"],
      "properties": {
        "otp_version": { "const": "27.3.2" },
        "image_id": { "type": "string", "pattern": "^sha256:[a-f0-9]{64}$" },
        "marker_observed": { "const": true }
      }
    },
    "patched": {
      "type": "object",
      "additionalProperties": false,
      "required": ["otp_version", "image_id", "marker_observed"],
      "properties": {
        "otp_version": { "const": "27.3.3" },
        "image_id": { "type": "string", "pattern": "^sha256:[a-f0-9]{64}$" },
        "marker_observed": { "const": false }
      }
    }
  }
}
