{
  "schema_version": "1.0.0",
  "cve_id": "CVE-2025-32433",
  "network_isolation": "compose-internal-only",
  "probe": {
    "kind": "fixed-marker-only",
    "sha256": "4b7fcede6c6a8fdaa2c6eea6868ccce608a75f8107c0439dbe68c43b2ff5cd34",
    "marker_path": "/tmp/cve-2025-32433-proof",
    "marker_value": "RH-LAB-PREAUTH-EXEC"
  },
  "server_source_sha256": "12d4286ae6a22da4777f040c2a63f2ad57d8497a7a3aa0fc9c58b00fa48646c9",
  "reproducibility": {
    "uncached_builds": 2,
    "image_ids_equal": true
  },
  "vulnerable": {
    "otp_version": "27.3.2",
    "image_id": "sha256:00dbf728f40d9b4d8dde0e9b70efa7ec192379b3ddb03c3e42ea1853d65c440c",
    "marker_observed": true
  },
  "patched": {
    "otp_version": "27.3.3",
    "image_id": "sha256:2c2eba19e4bd06ac2fdc1bcaa1e864999b3ca2cad8d5fe452ca5ad27b7c9dd11",
    "marker_observed": false
  }
}
